{
  "projectName": "Smart Meter Dashboard",
  "developer": "Naineet Tech Team",
  "repository": "https://github.com/naineet-tech/smart-meter-dashboard",
  "technology": [
    "Java",
    "Spring Boot",
    "React",
    "MySQL"
  ],
  "deviceType": "Smart Electricity Meter",
  "supportedActions": [
    "READ",
    "CONNECT",
    "DISCONNECT",
    "SET_LOAD"
  ],
  "version": "1.0.0",
  "status": "DEVELOPMENT"
}